{
  "id": "catherine-blakespear",
  "name": "Catherine Blakespear",
  "type": "state_legislator",
  "title": "California State Senator, Chair of the Senate Environmental Quality Committee",
  "district": "California State Senate District 38 (northern San Diego County and southern Orange County, coastal)",
  "years_of_service": "December 5, 2022–present.",
  "background": [
    "Blakespear describes herself as a fourth-generation San Diegan. She earned a B.S./M.S. in journalism from Northwestern University in 1999 and a J.D. from the University of Utah's S.J. Quinney College of Law in 2006. She worked as a journalist for the Los Angeles Times and the Associated Press before practicing law at Ray Quinney & Nebeker. (Source: official Senate biography, sd38.senate.ca.gov, and Ballotpedia, Catherine Blakespear.)",
    "She entered local government as a traffic commissioner and city council member in Encinitas before being elected Mayor of Encinitas in 2016. She was elected to the State Senate in November 2022 for the open, newly drawn District 38 seat, defeating Republican Matt Gunderson 52.2%–47.8% after both advanced from a nonpartisan top-two primary. She was re-elected in the June 2026 primary with 51.9% against Republican Laura Bassett, advancing to the November 2026 general election. (Source: Ballotpedia, Catherine Blakespear.)",
    "In the Senate she chairs the Environmental Quality Committee (2025–2026 session) and previously chaired the Human Services Committee (2023–2024 session). Her official biography describes her focus areas as economic opportunity, environmental protection, public safety, homelessness reduction, and transportation. (Source: official Senate biography.)"
  ],
  "committee_memberships": [
    "Chair, Senate Environmental Quality Committee (2025–2026 session)",
    "Member, Joint Legislative Committee on Climate Change Policies",
    "Member, Senate Budget and Fiscal Review Committee",
    "Member, Senate Governmental Organization Committee",
    "Member, Senate Transportation Committee",
    "Former Chair, Senate Human Services Committee (2023–2024 session)"
  ],
  "voting_record_highlights": [
    "SB 417 (2023), regulating licensed firearms dealers: Blakespear was lead author. The Senate concurred in Assembly amendments 32–5 on September 6, 2023 (Assembly floor vote 63–0), and Gov. Gavin Newsom signed it September 26, 2023 as Chapter 252, Statutes of 2023. (Source: leginfo.legislature.ca.gov bill status and vote record for SB 417.)",
    "SB 452 (2023), a firearms-regulation bill Blakespear authored: the Senate concurred in Assembly amendments 30–9 on September 14, 2023 (Assembly floor vote 55–18), and Gov. Newsom signed it September 26, 2023 as Chapter 253, Statutes of 2023. (Source: leginfo.legislature.ca.gov bill status and vote record for SB 452.)",
    "SB 7 (2024), addressing regional housing-need determinations: Blakespear was lead author. The Senate concurred in Assembly amendments 31–8 on August 28, 2024 (Assembly floor vote 54–16), and Gov. Newsom signed it September 19, 2024 as Chapter 283, Statutes of 2024. (Source: leginfo.legislature.ca.gov bill status and vote record for SB 7.)",
    "SB 954 (2026), a CEQA exemption for advanced manufacturing facilities Blakespear authored: it passed both houses (Assembly amendments concurred in 28–10 on August 28, 2026) but was vetoed by Gov. Newsom on September 18, 2026, matching a press statement on her official Senate site responding to the veto. (Source: leginfo.legislature.ca.gov bill status for SB 954; sd38.senate.ca.gov newsroom.)",
    "SB 42 (2025–2026), the California Fair Elections Act of 2026: Blakespear was a Senate Principal Coauthor (the three lead authors were Umberg, Allen, and Cervantes). The Senate concurred in Assembly amendments 29–8 on September 13, 2025, and Gov. Newsom signed it October 2, 2025 as Chapter 245, Statutes of 2025, placing the measure before voters as Proposition 4 on the November 2026 ballot. Full detail on the measure itself is covered in content/measures/ca-prop-4-2026.json and is not duplicated here."
  ],
  "attendance": "No individually published floor-attendance or voting-participation record for Senator Blakespear was found. Direct inspection of leginfo.legislature.ca.gov's vote-history pages for several of her bills (SB 417, SB 452, SB 7, SB 954) confirms the Legislature publishes only bill-by-bill roll-call votes (ayes, noes, and members not voting per motion), not an aggregated per-member attendance record. There is no senate.ca.gov or leginfo.legislature.ca.gov page reporting an overall attendance rate for any senator.",
  "endorsements_received": [
    { "name": "Democratic Party of California", "type": "org", "notes": "Endorsed Blakespear's 2026 re-election campaign, per Ballotpedia." },
    { "name": "California Teachers Association", "type": "org", "notes": "2026 campaign endorsement, per Ballotpedia." },
    { "name": "California Environmental Voters", "type": "org", "notes": "2026 campaign endorsement, per Ballotpedia." },
    { "name": "California Young Democrats", "type": "org", "notes": "2026 campaign endorsement, per Ballotpedia." },
    { "name": "Equality California", "type": "org", "notes": "2026 campaign endorsement, per Ballotpedia." },
    { "name": "Planned Parenthood of Orange and San Bernardino Counties Community Action Fund", "type": "org", "notes": "2026 campaign endorsement, per Ballotpedia." },
    { "name": "Sierra Club Angeles Chapter", "type": "org", "notes": "2026 campaign endorsement, per Ballotpedia." }
  ],
  "past_measures_authored": [
    {
      "title": "SB 417 (2023) — licensed firearms dealer regulation",
      "year": "2023",
      "outcome": "Signed into law by Gov. Gavin Newsom on September 26, 2023; Chapter 252, Statutes of 2023.",
      "source_url": "https://leginfo.legislature.ca.gov/faces/billStatusClient.xhtml?bill_id=202320240SB417"
    },
    {
      "title": "SB 452 (2023) — firearms regulation",
      "year": "2023",
      "outcome": "Signed into law by Gov. Gavin Newsom on September 26, 2023; Chapter 253, Statutes of 2023.",
      "source_url": "https://leginfo.legislature.ca.gov/faces/billStatusClient.xhtml?bill_id=202320240SB452"
    },
    {
      "title": "SB 7 (2024) — regional housing need determinations",
      "year": "2024",
      "outcome": "Signed into law by Gov. Gavin Newsom on September 19, 2024; Chapter 283, Statutes of 2024.",
      "source_url": "https://leginfo.legislature.ca.gov/faces/billStatusClient.xhtml?bill_id=202320240SB7"
    },
    {
      "title": "SB 954 (2026) — CEQA exemption for advanced manufacturing facilities",
      "year": "2026",
      "outcome": "Passed both houses but vetoed by Gov. Gavin Newsom on September 18, 2026.",
      "source_url": "https://leginfo.legislature.ca.gov/faces/billStatusClient.xhtml?bill_id=202520260SB954"
    }
  ],
  "sources": [
    { "title": "Official California State Senate biography and homepage, Senator Catherine Blakespear (SD 38)", "url": "https://sd38.senate.ca.gov/", "retrieved": "2026-09-22" },
    { "title": "Official California State Senate, Senator Catherine Blakespear newsroom (press releases, including SB 954 veto statement)", "url": "https://sd38.senate.ca.gov/newsroom/press-releases", "retrieved": "2026-09-22" },
    { "title": "Ballotpedia, Catherine Blakespear", "url": "https://ballotpedia.org/Catherine_Blakespear", "retrieved": "2026-09-22" },
    { "title": "California Legislature, SB 417 (2023–2024) bill status and votes", "url": "https://leginfo.legislature.ca.gov/faces/billStatusClient.xhtml?bill_id=202320240SB417", "retrieved": "2026-09-22" },
    { "title": "California Legislature, SB 452 (2023–2024) bill status and votes", "url": "https://leginfo.legislature.ca.gov/faces/billStatusClient.xhtml?bill_id=202320240SB452", "retrieved": "2026-09-22" },
    { "title": "California Legislature, SB 7 (2023–2024) bill status and votes", "url": "https://leginfo.legislature.ca.gov/faces/billStatusClient.xhtml?bill_id=202320240SB7", "retrieved": "2026-09-22" },
    { "title": "California Legislature, SB 954 (2025–2026) bill status and veto history", "url": "https://leginfo.legislature.ca.gov/faces/billStatusClient.xhtml?bill_id=202520260SB954", "retrieved": "2026-09-22" },
    { "title": "California Legislature, SB 42 (2025–2026) bill status, authors, and votes", "url": "https://leginfo.legislature.ca.gov/faces/billStatusClient.xhtml?bill_id=202520260SB42", "retrieved": "2026-09-22" }
  ],
  "last_updated": "2026-09-22"
}
